{
  "$schema": "http://json-schema.org/draft-07/schema#",
  "$id": "https://minicrm.benchmark/schemas/reconstruction-output.schema.json",
  "title": "MiniCRM API reconstruction output",
  "description": "Canonical deliverable for baseline and evaluated reverse-engineering agents. Evidence may only cite browser UI, cookies, headers, and HTTP traffic. Do not cite source code.",
  "type": "object",
  "required": [
    "schema_version",
    "operations",
    "semantic_facts",
    "dependencies",
    "workflows",
    "claims"
  ],
  "additionalProperties": false,
  "properties": {
    "schema_version": {
      "type": "string",
      "const": "1.0.0"
    },
    "benchmark_name": {
      "type": "string"
    },
    "reconstructed_at": {
      "type": "string",
      "description": "ISO-8601 timestamp of when the reconstruction was produced. Optional."
    },
    "notes": {
      "type": "string"
    },
    "components": {
      "type": "object",
      "description": "Named JSON Schema fragments. Request/response schemas may $ref these as #/components/{Name}.",
      "additionalProperties": {
        "type": "object"
      }
    },
    "confidence": {
      "$ref": "#/definitions/confidenceBlock"
    },
    "operations": {
      "type": "array",
      "items": { "$ref": "#/definitions/operation" }
    },
    "semantic_facts": {
      "type": "array",
      "items": { "$ref": "#/definitions/semanticFact" }
    },
    "dependencies": {
      "type": "array",
      "items": { "$ref": "#/definitions/dependency" }
    },
    "workflows": {
      "type": "array",
      "items": { "$ref": "#/definitions/workflow" }
    },
    "actions": {
      "type": "array",
      "description": "Optional UI-action reconstruction. Agents may omit this if they only recover the API.",
      "items": { "$ref": "#/definitions/action" }
    },
    "claims": {
      "type": "array",
      "items": { "$ref": "#/definitions/claim" }
    }
  },
  "definitions": {
    "jsonSchema": {
      "description": "A JSON Schema document or fragment describing a request or response body. Use null when there is no body.",
      "type": ["object", "null"]
    },
    "confidenceValue": {
      "type": "number",
      "minimum": 0,
      "maximum": 1
    },
    "confidenceBlock": {
      "type": "object",
      "additionalProperties": false,
      "properties": {
        "overall": { "$ref": "#/definitions/confidenceValue" },
        "operations": { "$ref": "#/definitions/confidenceValue" },
        "parameters": { "$ref": "#/definitions/confidenceValue" },
        "schemas": { "$ref": "#/definitions/confidenceValue" },
        "semantics": { "$ref": "#/definitions/confidenceValue" },
        "dependencies": { "$ref": "#/definitions/confidenceValue" },
        "workflows": { "$ref": "#/definitions/confidenceValue" }
      }
    },
    "evidence": {
      "type": "object",
      "required": ["kind"],
      "additionalProperties": false,
      "properties": {
        "kind": {
          "type": "string",
          "enum": [
            "network_request",
            "network_response",
            "ui_label",
            "ui_control",
            "ui_action",
            "cookie",
            "header"
          ]
        },
        "page": {
          "type": "string",
          "description": "UI route where the observation was made, e.g. /orders/new"
        },
        "method": { "type": "string" },
        "path": {
          "type": "string",
          "description": "Request path as observed, possibly with concrete IDs"
        },
        "status": { "type": "integer" },
        "json_paths": {
          "type": "array",
          "items": { "type": "string" },
          "description": "JSON Pointer or JSONPath into the observed body, e.g. $.statusId"
        },
        "header": { "type": "string" },
        "cookie_name": { "type": "string" },
        "ui_text": { "type": "string" },
        "note": { "type": "string" }
      }
    },
    "evidenceList": {
      "type": "array",
      "items": { "$ref": "#/definitions/evidence" }
    },
    "parameter": {
      "type": "object",
      "required": ["name", "location"],
      "additionalProperties": false,
      "properties": {
        "name": { "type": "string" },
        "location": {
          "type": "string",
          "enum": ["path", "query", "header", "cookie"]
        },
        "required": { "type": "boolean" },
        "type": {
          "type": "string",
          "enum": ["string", "integer", "number", "boolean", "array", "object", "unknown"]
        },
        "description": { "type": "string" },
        "enum": {
          "type": "array",
          "items": { "type": ["string", "number", "boolean", "null"] }
        },
        "default": {},
        "confidence": { "$ref": "#/definitions/confidenceValue" },
        "evidence": { "$ref": "#/definitions/evidenceList" }
      }
    },
    "errorResponse": {
      "type": "object",
      "required": ["status"],
      "additionalProperties": false,
      "properties": {
        "status": { "type": "integer" },
        "code": { "type": "string" },
        "message": { "type": "string" },
        "schema": { "$ref": "#/definitions/jsonSchema" },
        "confidence": { "$ref": "#/definitions/confidenceValue" },
        "evidence": { "$ref": "#/definitions/evidenceList" }
      }
    },
    "operation": {
      "type": "object",
      "required": ["method", "path"],
      "additionalProperties": false,
      "properties": {
        "id": { "type": "string" },
        "method": {
          "type": "string",
          "enum": ["GET", "POST", "PUT", "PATCH", "DELETE", "HEAD", "OPTIONS"]
        },
        "path": {
          "type": "string",
          "description": "Normalized path using {param} placeholders"
        },
        "summary": { "type": "string" },
        "parameters": {
          "type": "array",
          "items": { "$ref": "#/definitions/parameter" }
        },
        "request_schema": { "$ref": "#/definitions/jsonSchema" },
        "response_schema": { "$ref": "#/definitions/jsonSchema" },
        "success_status": { "type": "integer" },
        "error_responses": {
          "type": "array",
          "items": { "$ref": "#/definitions/errorResponse" }
        },
        "authentication": {
          "type": "string",
          "description": "e.g. session-cookie, none"
        },
        "confidence": { "$ref": "#/definitions/confidenceValue" },
        "evidence": { "$ref": "#/definitions/evidenceList" }
      }
    },
    "semanticFact": {
      "type": "object",
      "required": ["id", "meaning"],
      "additionalProperties": false,
      "properties": {
        "id": { "type": "string" },
        "subject": { "type": "string" },
        "value": {
          "type": ["string", "number", "boolean", "object", "array", "null"]
        },
        "meaning": { "type": "string" },
        "kind": {
          "type": "string",
          "enum": [
            "enum_mapping",
            "state_transition",
            "query_semantics",
            "validation",
            "concurrency",
            "business_constraint",
            "identifier_meaning",
            "derived_value",
            "auth"
          ]
        },
        "confidence": { "$ref": "#/definitions/confidenceValue" },
        "evidence": { "$ref": "#/definitions/evidenceList" }
      }
    },
    "dependency": {
      "type": "object",
      "required": ["id", "source_operation", "target_operation"],
      "additionalProperties": false,
      "properties": {
        "id": { "type": "string" },
        "source_operation": {
          "type": "string",
          "description": "METHOD /normalized/path, or * for any matching request"
        },
        "source_field": { "type": "string" },
        "target_operation": { "type": "string" },
        "target_field": { "type": "string" },
        "kind": {
          "type": "string",
          "enum": ["auth", "lookup", "concurrency", "payload", "filter"]
        },
        "description": { "type": "string" },
        "confidence": { "$ref": "#/definitions/confidenceValue" },
        "evidence": { "$ref": "#/definitions/evidenceList" }
      }
    },
    "workflowStep": {
      "type": "object",
      "required": ["operation"],
      "additionalProperties": false,
      "properties": {
        "id": { "type": "string" },
        "operation": {
          "type": "string",
          "description": "METHOD /normalized/path"
        },
        "role": {
          "type": "string",
          "enum": ["required_business", "auxiliary_lookup", "refresh", "auth"]
        },
        "depends_on": {
          "type": "array",
          "items": { "type": "string" }
        },
        "condition": { "type": "string" },
        "description": { "type": "string" }
      }
    },
    "workflow": {
      "type": "object",
      "required": ["id", "user_goal", "steps"],
      "additionalProperties": false,
      "properties": {
        "id": { "type": "string" },
        "user_goal": { "type": "string" },
        "steps": {
          "type": "array",
          "minItems": 1,
          "items": { "$ref": "#/definitions/workflowStep" }
        },
        "confidence": { "$ref": "#/definitions/confidenceValue" },
        "evidence": { "$ref": "#/definitions/evidenceList" }
      }
    },
    "action": {
      "type": "object",
      "required": ["id", "label_or_description", "risk"],
      "additionalProperties": false,
      "properties": {
        "id": { "type": "string" },
        "page": { "type": "string" },
        "label_or_description": { "type": "string" },
        "risk": {
          "type": "string",
          "enum": [
            "read_only",
            "safe_mutation",
            "reversible",
            "destructive",
            "external_side_effect",
            "unknown"
          ]
        },
        "expected_operations": {
          "type": "array",
          "items": { "type": "string" }
        },
        "confidence": { "$ref": "#/definitions/confidenceValue" },
        "evidence": { "$ref": "#/definitions/evidenceList" }
      }
    },
    "claim": {
      "type": "object",
      "required": ["id", "statement"],
      "additionalProperties": false,
      "properties": {
        "id": { "type": "string" },
        "statement": { "type": "string" },
        "supports": {
          "type": "array",
          "items": { "type": "string" },
          "description": "IDs of operations, facts, dependencies, or workflows this claim supports or restates"
        },
        "confidence": { "$ref": "#/definitions/confidenceValue" },
        "evidence": { "$ref": "#/definitions/evidenceList" }
      }
    }
  }
}
