{
  "schema_version": "1.0.0",
  "operations": [
    {
      "method": "DELETE",
      "path": "/api/customers/{}",
      "parameters": [
        {
          "name": "id",
          "location": "path",
          "type": "integer",
          "required": true
        }
      ],
      "evidence": [
        {
          "kind": "ui_action",
          "page": "/customers/208",
          "ui_text": "Delete",
          "note": "Blocked destructive intent; no HTTP request was sent."
        }
      ],
      "id": "op-1"
    },
    {
      "method": "DELETE",
      "path": "/api/orders/{}",
      "parameters": [
        {
          "name": "id",
          "location": "path",
          "type": "integer",
          "required": true
        }
      ],
      "evidence": [
        {
          "kind": "ui_control",
          "page": "/orders/2007",
          "ui_text": "Delete draft"
        },
        {
          "kind": "ui_action",
          "page": "/orders/2007",
          "ui_text": "Delete draft",
          "note": "Destructive intent was observed in the UI; no HTTP request was sent."
        }
      ],
      "id": "op-2"
    },
    {
      "method": "GET",
      "path": "/api/auth/session",
      "response_schema": {
        "type": "object",
        "properties": {
          "csrfToken": {
            "type": "string"
          },
          "user": {
            "type": "object",
            "properties": {
              "email": {
                "type": "string"
              },
              "id": {
                "type": "integer"
              },
              "name": {
                "type": "string"
              }
            }
          }
        }
      },
      "success_status": 200,
      "evidence": [
        {
          "kind": "network_response",
          "method": "GET",
          "path": "/api/auth/session",
          "status": 200,
          "json_paths": [
            "$.csrfToken",
            "$.user"
          ]
        }
      ],
      "id": "op-3"
    },
    {
      "method": "GET",
      "path": "/api/countries",
      "response_schema": {
        "type": "array",
        "items": {
          "type": "object",
          "properties": {
            "code": {
              "type": "string"
            },
            "name": {
              "type": "string"
            }
          }
        }
      },
      "success_status": 200,
      "evidence": [
        {
          "kind": "network_response",
          "method": "GET",
          "path": "/api/countries",
          "status": 200,
          "json_paths": [
            "$"
          ]
        }
      ],
      "id": "op-4"
    },
    {
      "method": "GET",
      "path": "/api/customers",
      "parameters": [
        {
          "name": "archived",
          "location": "query",
          "type": "boolean",
          "required": false
        },
        {
          "name": "page",
          "location": "query",
          "type": "integer",
          "required": false
        },
        {
          "name": "pageSize",
          "location": "query",
          "type": "integer",
          "required": false
        }
      ],
      "response_schema": {
        "type": "object",
        "properties": {
          "items": {
            "type": "array",
            "items": {
              "type": "object",
              "properties": {
                "archived": {
                  "type": "boolean"
                },
                "createdAt": {
                  "type": "string"
                },
                "email": {
                  "type": "string"
                },
                "firstName": {
                  "type": "string"
                },
                "id": {
                  "type": "integer"
                },
                "lastName": {
                  "type": "string"
                },
                "phone": {
                  "type": [
                    "string",
                    "null"
                  ]
                },
                "updatedAt": {
                  "type": "string"
                },
                "version": {
                  "type": "integer"
                }
              }
            }
          },
          "page": {
            "type": "integer"
          },
          "pageSize": {
            "type": "integer"
          },
          "total": {
            "type": "integer"
          }
        }
      },
      "success_status": 200,
      "evidence": [
        {
          "kind": "network_request",
          "method": "GET",
          "path": "/api/customers"
        },
        {
          "kind": "network_response",
          "method": "GET",
          "path": "/api/customers",
          "status": 200,
          "json_paths": [
            "$.items",
            "$.page",
            "$.pageSize",
            "$.total"
          ]
        }
      ],
      "id": "op-5"
    },
    {
      "method": "GET",
      "path": "/api/customers/{}",
      "parameters": [
        {
          "name": "id",
          "location": "path",
          "type": "integer",
          "required": true
        }
      ],
      "response_schema": {
        "type": "object",
        "properties": {
          "archived": {
            "type": "boolean"
          },
          "createdAt": {
            "type": "string"
          },
          "email": {
            "type": "string"
          },
          "firstName": {
            "type": "string"
          },
          "id": {
            "type": "integer"
          },
          "lastName": {
            "type": "string"
          },
          "phone": {
            "type": [
              "string",
              "null"
            ]
          },
          "updatedAt": {
            "type": "string"
          },
          "version": {
            "type": "integer"
          }
        }
      },
      "success_status": 200,
      "evidence": [
        {
          "kind": "network_response",
          "method": "GET",
          "path": "/api/customers/207",
          "status": 200,
          "json_paths": [
            "$"
          ]
        }
      ],
      "id": "op-6"
    },
    {
      "method": "GET",
      "path": "/api/customers/{}/addresses",
      "parameters": [
        {
          "name": "id",
          "location": "path",
          "type": "integer",
          "required": true
        }
      ],
      "response_schema": {
        "type": "array",
        "items": {
          "type": "object",
          "properties": {
            "city": {
              "type": "string"
            },
            "countryCode": {
              "type": "string"
            },
            "countryName": {
              "type": "string"
            },
            "createdAt": {
              "type": "string"
            },
            "customerId": {
              "type": "integer"
            },
            "id": {
              "type": "integer"
            },
            "label": {
              "type": "string"
            },
            "line1": {
              "type": "string"
            },
            "line2": {
              "type": [
                "string",
                "null"
              ]
            },
            "postalCode": {
              "type": "string"
            },
            "regionCode": {
              "type": "string"
            },
            "regionId": {
              "type": "integer"
            },
            "regionName": {
              "type": "string"
            },
            "updatedAt": {
              "type": "string"
            }
          }
        }
      },
      "success_status": 200,
      "evidence": [
        {
          "kind": "network_response",
          "method": "GET",
          "path": "/api/customers/207/addresses",
          "status": 200,
          "json_paths": [
            "$"
          ]
        }
      ],
      "id": "op-7"
    },
    {
      "method": "GET",
      "path": "/api/customers/suggest",
      "parameters": [
        {
          "name": "q",
          "location": "query",
          "type": "string",
          "required": false
        }
      ],
      "response_schema": {
        "type": "array",
        "items": {
          "type": "object",
          "properties": {
            "email": {
              "type": "string"
            },
            "id": {
              "type": "integer"
            },
            "name": {
              "type": "string"
            }
          }
        }
      },
      "success_status": 200,
      "evidence": [
        {
          "kind": "network_request",
          "method": "GET",
          "path": "/api/customers/suggest"
        },
        {
          "kind": "network_response",
          "method": "GET",
          "path": "/api/customers/suggest",
          "status": 200,
          "json_paths": [
            "$"
          ]
        }
      ],
      "id": "op-8"
    },
    {
      "method": "GET",
      "path": "/api/dashboard/summary",
      "parameters": [
        {
          "name": "period",
          "location": "query",
          "type": "string",
          "required": false
        }
      ],
      "response_schema": {
        "type": "object",
        "properties": {
          "customerCount": {
            "type": "integer"
          },
          "orderCount": {
            "type": "integer"
          },
          "ordersByStatus": {
            "type": "array",
            "items": {
              "type": "object",
              "properties": {
                "count": {
                  "type": "integer"
                },
                "statusId": {
                  "type": "integer"
                }
              }
            }
          },
          "revenueCents": {
            "type": "integer"
          }
        }
      },
      "success_status": 200,
      "evidence": [
        {
          "kind": "network_response",
          "method": "GET",
          "path": "/api/dashboard/summary",